id,platform,title,text,author,created_utc,score,num_comments,url
UgyomHxXjwEJYVBpzdp4AaABAg,youtube,,JAJAJA WEY SE COMEN DE A CINCO!!! DE A CINCO FOKIN BOTS! JAJAJAJA CINCOOOOOOOO!!!!!,@medicoa5904,2025-11-17 07:45:33,0,0,https://youtube.com/watch?v=dxcFXoI6grM&lc=UgyomHxXjwEJYVBpzdp4AaABAg
Ugx3yV-DkLZIQCxFWPF4AaABAg,youtube,,Damos color al futbol... JAJAJAJ vaya RIDICULOS!!! Se QUEDAN CORTOS por que ELLOS SON EL FUTBOL!!! RESPETEN A PAPÁ QUE LES HA DADO SU UNICO MUNDIAL UNOCERISMO :D,@medicoa5904,2025-11-17 07:44:25,0,0,https://youtube.com/watch?v=dxcFXoI6grM&lc=Ugx3yV-DkLZIQCxFWPF4AaABAg
UgyMpWxO8HHtRMIs9Mt4AaABAg,youtube,,"1:47 Ramos entering the scoring line to try to stop the goal when it has already passed the line 😂

10:46 Ramos failing to control a ball that allows Sergi to give it to Suarez for the 4th goal

They still will tell you he's in the top 5 defenders because he scored goals, but Pepe and Varane > Ramos for Real Madrid, and Puyol/Pique > Ramos for Spain.",@maenlest17,2025-11-17 05:48:22,0,0,https://youtube.com/watch?v=dxcFXoI6grM&lc=UgyMpWxO8HHtRMIs9Mt4AaABAg
Ugzfaxh0I-HnX3JWy6Z4AaABAg,youtube,,En el min 90 los comentaristas hablando de que el madrid tuvo 15 min que raro 😂😂😂😂😂,@anap-y2b,2025-11-17 00:20:35,0,0,https://youtube.com/watch?v=dxcFXoI6grM&lc=Ugzfaxh0I-HnX3JWy6Z4AaABAg
UgxS5Su1wsabzY49svp4AaABAg,youtube,,"LUIS SUAREZ MÍNIMO TENDRÍA UNOS 2 BALONES DE ORO,,,❤😂",@AlbertoLopez-c8n9y,2025-11-16 02:17:16,0,0,https://youtube.com/watch?v=dxcFXoI6grM&lc=UgxS5Su1wsabzY49svp4AaABAg
UgyFbv3fe8JT8Z5mlvB4AaABAg,youtube,,kiedy Thibaut Courtois myśli że jest najlepszy - przychodzi Barca- i tak lecą lata,@profi1920,2025-11-15 21:32:11,0,0,https://youtube.com/watch?v=dxcFXoI6grM&lc=UgyFbv3fe8JT8Z5mlvB4AaABAg
UgzvcdrMBSM0MqE-Uy94AaABAg,youtube,,Millonarios jugando su pendejada y la gente ridícula viéndolos jugar sus mamadas,@HamzaSalazar-m5c,2025-11-15 10:28:19,0,0,https://youtube.com/watch?v=dxcFXoI6grM&lc=UgzvcdrMBSM0MqE-Uy94AaABAg
UgwKASWwFisj-saKCOl4AaABAg,youtube,,10:49 suuaaaarezzzzz 😂,@mozazilong,2025-11-15 02:37:39,0,0,https://youtube.com/watch?v=dxcFXoI6grM&lc=UgwKASWwFisj-saKCOl4AaABAg
UgzPKVKH13rCJorSEdZ4AaABAg,youtube,,10:49 suuaaaarezzzzz😂,@mozazilong,2025-11-15 02:37:14,0,0,https://youtube.com/watch?v=dxcFXoI6grM&lc=UgzPKVKH13rCJorSEdZ4AaABAg
UgxWbXuwskDoaznqPXh4AaABAg,youtube,,Suarez>benzema+balondor,@zeusrai3343,2025-11-13 15:38:21,0,0,https://youtube.com/watch?v=dxcFXoI6grM&lc=UgxWbXuwskDoaznqPXh4AaABAg
UgxejpzYdJm55AqacP54AaABAg,youtube,,Those days,@Laughter_is_free_1,2025-11-13 00:37:50,0,0,https://youtube.com/watch?v=dxcFXoI6grM&lc=UgxejpzYdJm55AqacP54AaABAg
Ugy2r7V9GMi6oiJM9Qp4AaABAg,youtube,,amazing❤‍🔥❤‍🔥,@sepehrtayebi1352,2025-11-12 13:01:09,0,0,https://youtube.com/watch?v=dxcFXoI6grM&lc=Ugy2r7V9GMi6oiJM9Qp4AaABAg
Ugw9RFnrMt9UgFSe_v94AaABAg,youtube,,Recuerdos de este clasicoo,@white18284,2025-11-09 17:06:02,0,0,https://youtube.com/watch?v=dxcFXoI6grM&lc=Ugw9RFnrMt9UgFSe_v94AaABAg
UgxCG0d179U4rmXksxZ4AaABAg,youtube,,Suarez been the best striker I don't care what everybody been saying. Barcelona literally had Real Madrid for lunch on this day 😂😂😭🔥,@ashinmichael7765,2025-11-09 10:20:19,0,0,https://youtube.com/watch?v=dxcFXoI6grM&lc=UgxCG0d179U4rmXksxZ4AaABAg
UgwreLD69Bk5sSVdA7Z4AaABAg,youtube,,Pique’s hand gesture at the end  was epic . MANITA,@chiya2006,2025-11-08 19:33:17,0,0,https://youtube.com/watch?v=dxcFXoI6grM&lc=UgwreLD69Bk5sSVdA7Z4AaABAg
UgyjYshDsWYl5phZ2PR4AaABAg,youtube,,Just Love the Loud Atmosphere on every Barca Goaaaaaaaaaaaaaaaaaaaaaal,@MridulBhattarai-x2b,2025-11-08 12:22:44,0,0,https://youtube.com/watch?v=dxcFXoI6grM&lc=UgyjYshDsWYl5phZ2PR4AaABAg
UgwzakaztejEuMO6OYF4AaABAg,youtube,,Balde have to learn alot from jordi alba,@salieusecka4269,2025-11-08 08:22:56,0,0,https://youtube.com/watch?v=dxcFXoI6grM&lc=UgwzakaztejEuMO6OYF4AaABAg
Ugz5WD_kLoD7SxqVYZZ4AaABAg,youtube,,"Man, almost everytime these 2 play, Madrid get hammered. Crazy!",@Azzurescio01,2025-11-04 09:15:07,0,0,https://youtube.com/watch?v=dxcFXoI6grM&lc=Ugz5WD_kLoD7SxqVYZZ4AaABAg
Ugx5MeCwWNv1DrTe9xZ4AaABAg,youtube,,Real Madrid équipe des animaux 😂🤣🤣,@bouzidmhamed7721,2025-11-02 23:08:15,0,0,https://youtube.com/watch?v=dxcFXoI6grM&lc=Ugx5MeCwWNv1DrTe9xZ4AaABAg
UgzsdUPnNP2qGD2D9Ih4AaABAg,youtube,,la de suarez era roja viejo,@tomasmendezdiaz3679,2025-10-31 14:46:56,0,0,https://youtube.com/watch?v=dxcFXoI6grM&lc=UgzsdUPnNP2qGD2D9Ih4AaABAg
UgzUmOEqpXcDx_CZqf94AaABAg,youtube,,"And the fact that Messi was even injured is mind blowing, I don't even know why people campare between Suarez and Benzema. It's not even close.",@24061699,2025-10-31 12:46:26,0,0,https://youtube.com/watch?v=dxcFXoI6grM&lc=UgzUmOEqpXcDx_CZqf94AaABAg
UgwuBzT3J9t7IkIsdnx4AaABAg,youtube,,11:42 😢 somewhere is MSN😢,@SuhailSuluvirat,2025-10-30 00:49:11,0,1,https://youtube.com/watch?v=dxcFXoI6grM&lc=UgwuBzT3J9t7IkIsdnx4AaABAg
UgzOZ1DxcD4uwTDpGJZ4AaABAg,youtube,,Neste dia o Lionel Messi estava lesionado mas nós ganhamos 5 a 1 com Luís Suarez marcando 3 golos,@MellodosGelosTomásTomás,2025-10-29 06:52:37,1,0,https://youtube.com/watch?v=dxcFXoI6grM&lc=UgzOZ1DxcD4uwTDpGJZ4AaABAg
Ugy3CpP5A7iR_I5B77d4AaABAg,youtube,,really miss this guy,@phatp114,2025-10-28 12:12:15,0,0,https://youtube.com/watch?v=dxcFXoI6grM&lc=Ugy3CpP5A7iR_I5B77d4AaABAg
UgzGrkRKBkC6PMeolbl4AaABAg,youtube,,3:03 what a save!,@johnhunter4272,2025-10-28 02:01:05,0,0,https://youtube.com/watch?v=dxcFXoI6grM&lc=UgzGrkRKBkC6PMeolbl4AaABAg
UgzHbeVQ9bdpV8kCrQ94AaABAg,youtube,,Sergi Roberto 🤩💫,@YashnarbekMadaminov-h2i,2025-10-26 12:35:37,0,0,https://youtube.com/watch?v=dxcFXoI6grM&lc=UgzHbeVQ9bdpV8kCrQ94AaABAg
UgzpbPPuKvtyn3E3mC14AaABAg,youtube,,"6 goles, todos de sudamericanos",@moiseseljachsuarez6593,2025-10-22 02:13:20,0,0,https://youtube.com/watch?v=dxcFXoI6grM&lc=UgzpbPPuKvtyn3E3mC14AaABAg
Ugzn9eOKWBBvKz4zNQ14AaABAg,youtube,,Prime Arthur lol,@VaisalRomadhon-y2j,2025-10-20 15:28:12,0,0,https://youtube.com/watch?v=dxcFXoI6grM&lc=Ugzn9eOKWBBvKz4zNQ14AaABAg
UgywT_SV9VSuXRYtoXV4AaABAg,youtube,,🖐🖐🖐🖐🖐,@opinadorlibre,2025-10-18 09:45:12,0,0,https://youtube.com/watch?v=dxcFXoI6grM&lc=UgywT_SV9VSuXRYtoXV4AaABAg
UgwlLnjGsGDNystODY14AaABAg,youtube,,visca barca,@jhonyklowor9670,2025-10-14 14:53:19,1,0,https://youtube.com/watch?v=dxcFXoI6grM&lc=UgwlLnjGsGDNystODY14AaABAg
Ugywgp4rokCCDA8J8S54AaABAg,youtube,,"suarez surely have some of the most iconic goals, always a joy to watch",@luson_18,2025-10-12 16:25:39,0,0,https://youtube.com/watch?v=dxcFXoI6grM&lc=Ugywgp4rokCCDA8J8S54AaABAg
UgyfJ3yCskCx4OC3ni94AaABAg,youtube,,Y eso que suarez entro al Barcelona en bajada....que hubiera sido si habria estado en cu Prime cuando estuvo en el Liverpool...otra cosa hubiera sido.,@AtagonzAII,2025-10-12 00:21:26,0,0,https://youtube.com/watch?v=dxcFXoI6grM&lc=UgyfJ3yCskCx4OC3ni94AaABAg
UgwBYdP5EwoJeNdhn6t4AaABAg,youtube,,El pistolero el mejor visca barça ❤️💙👑 humillamos a nuestros hijos ☠️,@YunaikerPernia-em4hi,2025-10-11 05:45:00,0,0,https://youtube.com/watch?v=dxcFXoI6grM&lc=UgwBYdP5EwoJeNdhn6t4AaABAg
UgwnV8I_QwZts-Fn7i94AaABAg,youtube,,4:35,@Power-zx8pi,2025-10-10 21:27:38,0,0,https://youtube.com/watch?v=dxcFXoI6grM&lc=UgwnV8I_QwZts-Fn7i94AaABAg
UgxzOwDJnGiC4rB3LwZ4AaABAg,youtube,,"Literalmente juego asi como Lucho, goles identicos a los q hago, lastima mi rodilla sino estaria con 9 balones de oro, yo hubiera hecho los 5, asi suave",@josemanueljuliosoto9303,2025-10-10 14:07:15,1,0,https://youtube.com/watch?v=dxcFXoI6grM&lc=UgxzOwDJnGiC4rB3LwZ4AaABAg
UgzUh6bPqxDDZzSQEmp4AaABAg,youtube,,"Real Madrid is a club of arbitration and corruption, not a professional football team 🤢🚮",@OussamaKoudssi,2025-10-03 11:30:19,2,0,https://youtube.com/watch?v=dxcFXoI6grM&lc=UgzUh6bPqxDDZzSQEmp4AaABAg
Ugx6MaX7mQFspOdkLpx4AaABAg,youtube,,visca barca,,2025-10-02 07:07:11,2,0,https://youtube.com/watch?v=dxcFXoI6grM&lc=Ugx6MaX7mQFspOdkLpx4AaABAg
UgwpbO5QSTWMy0Esrd94AaABAg,youtube,,There are 3 Balon d'or winners here 😏,@DanielWilliams-l9m,2025-09-29 15:13:25,3,1,https://youtube.com/watch?v=dxcFXoI6grM&lc=UgwpbO5QSTWMy0Esrd94AaABAg
Ugwkrob6pTyYyOaIgRt4AaABAg,youtube,,Coutinho😢,@petercastillo2821,2025-09-29 04:04:54,1,0,https://youtube.com/watch?v=dxcFXoI6grM&lc=Ugwkrob6pTyYyOaIgRt4AaABAg
UgyBH_nJzDtVjkuNx0d4AaABAg,youtube,,no Messi no party... not intresting,@Fess_23,2025-09-25 20:15:23,1,0,https://youtube.com/watch?v=dxcFXoI6grM&lc=UgyBH_nJzDtVjkuNx0d4AaABAg
UgzFmMuApSI3R6S8BrZ4AaABAg,youtube,,Dare I say ter Stegen's decline started here 😔,@dly_steffan,2025-09-25 06:49:10,3,0,https://youtube.com/watch?v=dxcFXoI6grM&lc=UgzFmMuApSI3R6S8BrZ4AaABAg
UgxnV2f0lqPqtDk4ROl4AaABAg,youtube,,Dembele balon de oro crj el barza dejo ir a este jugadorazo y dejar ir a suarez  gran error,@kevinmore7885,2025-09-24 01:46:54,1,0,https://youtube.com/watch?v=dxcFXoI6grM&lc=UgxnV2f0lqPqtDk4ROl4AaABAg
UgzAHAUgLCXdC25win94AaABAg,youtube,,Todos los goles fueron sudamericanos,@lokotegui9210,2025-09-24 00:24:53,1,0,https://youtube.com/watch?v=dxcFXoI6grM&lc=UgzAHAUgLCXdC25win94AaABAg
UgwqayoJEs66Z0NWUWZ4AaABAg,youtube,,លាហឺយអុំពឺមិណឡ្អ,@sotheameracna-love,2025-09-23 03:19:00,0,0,https://youtube.com/watch?v=dxcFXoI6grM&lc=UgwqayoJEs66Z0NWUWZ4AaABAg
Ugy2V6cjpCBV8ZWTJJJ4AaABAg,youtube,,Tío le voy al Madrid pero tenemos que admitir que Suárez ha sido mejor que Benzema y si no fuera por las mordidas y Messi y cr7 tuviese 2 balones de oro,@FernandoCastellanos-vt9tw,2025-09-18 04:47:52,0,0,https://youtube.com/watch?v=dxcFXoI6grM&lc=Ugy2V6cjpCBV8ZWTJJJ4AaABAg
Ugxb-v8qrV1YlMV07Pl4AaABAg,youtube,,TODO BIEN EL VIDEO Y SALE EL PELO VUDAL MAL JUGADOR JUGADOR DEL MONTON,@leobardogarcia7739,2025-09-17 06:29:54,0,0,https://youtube.com/watch?v=dxcFXoI6grM&lc=Ugxb-v8qrV1YlMV07Pl4AaABAg
Ugwr6HZCeZ4O268kA6F4AaABAg,youtube,,I remember this clasico very fondly. It was on my birthday. Best present ever,@tonettalover,2025-09-16 12:02:48,0,0,https://youtube.com/watch?v=dxcFXoI6grM&lc=Ugwr6HZCeZ4O268kA6F4AaABAg
UgwRt9IHN5TxpYqjqcx4AaABAg,youtube,,10:19 that should have been a red card btw,@alexbay17,2025-09-11 21:37:56,2,0,https://youtube.com/watch?v=dxcFXoI6grM&lc=UgwRt9IHN5TxpYqjqcx4AaABAg
Ugz7YtC_KCIXaQ9_U894AaABAg,youtube,,"Barcelona 1-0 1:40
Barcelona 2-0 3:32
Real Madrid 2-1 6:16
Barcelona 3-1 9:17
Barcelona 4-1 10:42
Barcelona 5-1 11:26",@wazaviiii561,2025-09-10 02:53:35,0,0,https://youtube.com/watch?v=dxcFXoI6grM&lc=Ugz7YtC_KCIXaQ9_U894AaABAg
UgxMS1CusyoUmtzYsvJ4AaABAg,youtube,,Any time ( La Manita) 😅,@endrit.b16,2025-09-09 15:30:36,0,0,https://youtube.com/watch?v=dxcFXoI6grM&lc=UgxMS1CusyoUmtzYsvJ4AaABAg
UgzIr8LJs7mtV13jtQx4AaABAg,youtube,,Seguís siendo lameculos dé la meseta esteparia,@antoniomartinezrodriguez4446,2025-09-04 21:59:14,0,0,https://youtube.com/watch?v=dxcFXoI6grM&lc=UgzIr8LJs7mtV13jtQx4AaABAg
Ugw3oI3k6wOlc0OlCjh4AaABAg,youtube,,I love you Barsa.,@davehdez6461,2025-08-26 19:42:41,0,0,https://youtube.com/watch?v=dxcFXoI6grM&lc=Ugw3oI3k6wOlc0OlCjh4AaABAg
Ugxdc3hKTBn0Bfd-UHZ4AaABAg,youtube,,y todos goles de sudamericanos,@camellodeagua,2025-08-26 04:33:11,0,0,https://youtube.com/watch?v=dxcFXoI6grM&lc=Ugxdc3hKTBn0Bfd-UHZ4AaABAg
Ugx8reh0AyjGvuuef5B4AaABAg,youtube,,😂😂😂😂😂,@javadkhaky62,2025-08-22 22:33:00,1,0,https://youtube.com/watch?v=dxcFXoI6grM&lc=Ugx8reh0AyjGvuuef5B4AaABAg
Ugz_K2xxWffKygO1pn14AaABAg,youtube,,pique acting like he was the one that scored the goals,@leaf.ftbl-Official,2025-08-17 12:44:28,0,0,https://youtube.com/watch?v=dxcFXoI6grM&lc=Ugz_K2xxWffKygO1pn14AaABAg
Ugw4nmSZPIPh6SeHBSJ4AaABAg,youtube,,But some 🤡 compare Benzema with suarez,@yay5141,2025-08-08 19:50:36,0,0,https://youtube.com/watch?v=dxcFXoI6grM&lc=Ugw4nmSZPIPh6SeHBSJ4AaABAg
UgwsC15071rspwv1zwR4AaABAg,youtube,,Im just waiting for this mans icon card because his MLS card just aint it😂,@joneh9483,2025-08-05 10:08:07,0,0,https://youtube.com/watch?v=dxcFXoI6grM&lc=UgwsC15071rspwv1zwR4AaABAg
Ugzht3OrpJe7PJvaSF54AaABAg,youtube,,I still don't understand why barcelona swapped Arthur Melo for Pjanic.,@mahammar4328,2025-08-04 21:30:40,0,0,https://youtube.com/watch?v=dxcFXoI6grM&lc=Ugzht3OrpJe7PJvaSF54AaABAg
UgyGkghgnEEymsVJs7V4AaABAg,youtube,,"Courtois comiéndose 5 goles hizo mejor partido que Ter Stegen jajajaja. Es increíble que el Barcelona estuvo por tantos años con alguien que es mejor dando pases que atajando xd, luego se preguntan los cules por sus fracasos en champions. 

Con otro portero ya hubieran ganado la sexta jajajajajaja",@leonmedinaceli8189,2025-08-04 03:38:37,0,0,https://youtube.com/watch?v=dxcFXoI6grM&lc=UgyGkghgnEEymsVJs7V4AaABAg
Ugzt5VYSru5ZBnFuSUV4AaABAg,youtube,,El kante paytaxt,@Apokallibzis,2025-08-03 17:47:16,0,0,https://youtube.com/watch?v=dxcFXoI6grM&lc=Ugzt5VYSru5ZBnFuSUV4AaABAg
UgxA_zwGrebiXd8Ei-14AaABAg,youtube,,The voiceover sound is very similar to the PS 2025.🎮⚽️,@ศิรสิทชุมภูชนะภัย,2025-08-02 16:09:40,0,0,https://youtube.com/watch?v=dxcFXoI6grM&lc=UgxA_zwGrebiXd8Ei-14AaABAg
UgwGmYnFEo53tfGJJ694AaABAg,youtube,,They all know Suarez is one of a kind striker. He’s underrated,@abzygarba7212,2025-07-26 12:44:30,1,0,https://youtube.com/watch?v=dxcFXoI6grM&lc=UgwGmYnFEo53tfGJJ694AaABAg
UgyaQ8_oV5-gnCstW_R4AaABAg,youtube,,Jamás vuelvan a faltarle el respeto a Luis Suarez y compararlo con bendepan qué debutó y se retiró el mismo año,@TheAbner_1,2025-07-25 20:27:13,0,0,https://youtube.com/watch?v=dxcFXoI6grM&lc=UgyaQ8_oV5-gnCstW_R4AaABAg
UgyuZt9dag7DlWDXAkl4AaABAg,youtube,,Bye bye buzi real😂,@lacimeszaros7726,2025-07-21 20:32:07,0,0,https://youtube.com/watch?v=dxcFXoI6grM&lc=UgyuZt9dag7DlWDXAkl4AaABAg
UgxbBY1_Vzlcu6v8LsJ4AaABAg,youtube,,El Madrid sale fortalecido de esta goleada,@alexanderseton,2025-07-21 20:19:58,0,0,https://youtube.com/watch?v=dxcFXoI6grM&lc=UgxbBY1_Vzlcu6v8LsJ4AaABAg
UgxUceCTKphnpCYFAOp4AaABAg,youtube,,"asensio was fuking joke, he does not want to defend for his team, no backtracking opponent and ran in the field like a old man...and people thought he will be great player???....lol",@Holymoley1001,2025-07-20 20:58:29,0,0,https://youtube.com/watch?v=dxcFXoI6grM&lc=UgxUceCTKphnpCYFAOp4AaABAg
UgydlpTiK9J_lZlrluJ4AaABAg,youtube,,"Increíble gesto técnico de Suarez en su segundo gol, impresionante cabezazo.",@DeBarroAlOro,2025-07-19 14:30:30,0,0,https://youtube.com/watch?v=dxcFXoI6grM&lc=UgydlpTiK9J_lZlrluJ4AaABAg
UgzjhfhM7YlEaVvPNeF4AaABAg,youtube,,Barça el mejor,@FelipePezzi-zc2pv,2025-07-18 16:51:50,0,0,https://youtube.com/watch?v=dxcFXoI6grM&lc=UgzjhfhM7YlEaVvPNeF4AaABAg
Ugz9gyVQ3yQRX3Iwabh4AaABAg,youtube,,"Sé nota qué sois comentaristas lameculos dé la meseta, palomeros dé florentino",@antoniomartinezrodriguez4446,2025-07-16 20:11:53,0,0,https://youtube.com/watch?v=dxcFXoI6grM&lc=Ugz9gyVQ3yQRX3Iwabh4AaABAg
UgwTMlMnX0GcF45XRJR4AaABAg,youtube,,Jordi Alba was a very competent left-back,@edgarisaac1136,2025-07-16 06:51:35,0,0,https://youtube.com/watch?v=dxcFXoI6grM&lc=UgwTMlMnX0GcF45XRJR4AaABAg
UgwpxxDjAG3wpjbMAS14AaABAg,youtube,,No me acordaba de esta goleada es que hay tantas del Barcelona al Madrid,@dafnegarrido1655,2025-07-03 16:11:35,0,0,https://youtube.com/watch?v=dxcFXoI6grM&lc=UgwpxxDjAG3wpjbMAS14AaABAg
UgyjGPK-if5ukQ79jDJ4AaABAg,youtube,,Real madrid if given a chance will definitely take Luis suarez instead of  Benzema all day.,@gujibuandfriends9766,2025-07-02 06:07:33,0,0,https://youtube.com/watch?v=dxcFXoI6grM&lc=UgyjGPK-if5ukQ79jDJ4AaABAg
UgwVLX6Ut_bMHAZbDNB4AaABAg,youtube,,Que grande Sergi Roberto.... Lo k nos perdimos conformándonos con él de Lateral derecho,@greenbossYT,2025-07-01 00:28:16,0,0,https://youtube.com/watch?v=dxcFXoI6grM&lc=UgwVLX6Ut_bMHAZbDNB4AaABAg
UgweOrQayJSeSs6EoIl4AaABAg,youtube,,Gracias Dios por darme inteligencia y no ser del real mandril,@GerardoNicolasOrtegaBueno,2025-06-28 02:46:37,0,0,https://youtube.com/watch?v=dxcFXoI6grM&lc=UgweOrQayJSeSs6EoIl4AaABAg
Ugx7JPfZgfMqW97K8I94AaABAg,youtube,,First clasico without ronaldo 😓,@alienxyzmercury,2025-06-15 03:11:39,1,1,https://youtube.com/watch?v=dxcFXoI6grM&lc=Ugx7JPfZgfMqW97K8I94AaABAg
UgzTg0FxO6wXjF1DNT14AaABAg,youtube,,Bro Sergio Roberto was built different he was a playmaker,@dostonUergashev,2025-06-08 23:35:41,2,0,https://youtube.com/watch?v=dxcFXoI6grM&lc=UgzTg0FxO6wXjF1DNT14AaABAg
UgxGaMUQHMXgfTcK1Ml4AaABAg,youtube,,"Ash The Best ❤ Merci de toujours rendre un hommage à nos cultures, nos anciens, bref tout. Merci",@ousseynoundiaye3481,2025-06-01 11:17:52,0,0,https://youtube.com/watch?v=dxcFXoI6grM&lc=UgxGaMUQHMXgfTcK1Ml4AaABAg
UgzvppdfWtbrwuOcr2F4AaABAg,youtube,,Belum pernah bang dodo hatrick ke kgawang barca😂😂,@masipurcom9145,2025-06-01 01:44:35,0,0,https://youtube.com/watch?v=dxcFXoI6grM&lc=UgzvppdfWtbrwuOcr2F4AaABAg
UgwastMyyPNIDheUYrh4AaABAg,youtube,,Mesi and Messi Son Rection after goal by Suarez😂,@MessiGoat-f9f,2025-05-30 17:47:40,0,0,https://youtube.com/watch?v=dxcFXoI6grM&lc=UgwastMyyPNIDheUYrh4AaABAg
Ugyf8U_dC0vCZ9q9kcB4AaABAg,youtube,,i hate how slow this barca team is!!!!!!Why is jordi in the attack???,@juniorclos1007,2025-05-27 13:36:20,0,0,https://youtube.com/watch?v=dxcFXoI6grM&lc=Ugyf8U_dC0vCZ9q9kcB4AaABAg
Ugy72bmc2hJ8NtyAv4t4AaABAg,youtube,,Todavia me duele que coutinho no pudo con el barca.,@cezzhermosillo4478,2025-05-24 23:08:08,0,0,https://youtube.com/watch?v=dxcFXoI6grM&lc=Ugy72bmc2hJ8NtyAv4t4AaABAg
UgwzNJwUqT3rhg60R_x4AaABAg,youtube,,"Dios mio, que violación.   Cuántas van ya a día de hoy 24 de Mayo de 2025.   En esta última temporada han sido 4 seguidas.   Que siga la fiesta !!!!",@henrygallas3562,2025-05-24 18:25:22,0,0,https://youtube.com/watch?v=dxcFXoI6grM&lc=UgwzNJwUqT3rhg60R_x4AaABAg
UgxwZ1uJFkojJOmEY694AaABAg,youtube,,"May, 2025. Comeback here to see some El-Pistolero show",@akbarharits827,2025-05-24 11:09:29,0,0,https://youtube.com/watch?v=dxcFXoI6grM&lc=UgxwZ1uJFkojJOmEY694AaABAg
UgyCzb86JT-8nQFpYAF4AaABAg,youtube,,🖐🖐🖐🖐,@FarhadY-z2i,2025-05-22 15:53:25,0,0,https://youtube.com/watch?v=dxcFXoI6grM&lc=UgyCzb86JT-8nQFpYAF4AaABAg
Ugw3VeRsFJWZT753BBd4AaABAg,youtube,,Y sin Messi 💀,@paulocesarchavez9222,2025-05-19 14:58:04,0,0,https://youtube.com/watch?v=dxcFXoI6grM&lc=Ugw3VeRsFJWZT753BBd4AaABAg
Ugxn2bk1dGyjQzOLLFF4AaABAg,youtube,,"when we had suarez we knew that if the ball is 4m inside box or 1x1, it is 99% goal",@mqhamdam,2025-05-10 18:16:33,0,1,https://youtube.com/watch?v=dxcFXoI6grM&lc=Ugxn2bk1dGyjQzOLLFF4AaABAg
UgybNhMh-JmvRBVRmZJ4AaABAg,youtube,,visca barça 💟💟💟,@carlosoconhernandez3278,2025-05-09 08:07:56,0,0,https://youtube.com/watch?v=dxcFXoI6grM&lc=UgybNhMh-JmvRBVRmZJ4AaABAg
UgzSP-96OhfjtH_wQYF4AaABAg,youtube,,3:43？？PK？🤷🏻📹,@so-os8kz,2025-05-06 13:44:25,1,1,https://youtube.com/watch?v=dxcFXoI6grM&lc=UgzSP-96OhfjtH_wQYF4AaABAg
UgxHdUx7ZVsC-ZgfgUJ4AaABAg,youtube,,"holy that barca lineup gave me some ptsd, rakitic and suarez carried hard in these times",@lethalityrush105,2025-05-05 16:58:50,1,0,https://youtube.com/watch?v=dxcFXoI6grM&lc=UgxHdUx7ZVsC-ZgfgUJ4AaABAg
UgwEMPqfG64VF8gj7Eh4AaABAg,youtube,,Chimy Ávila >>>>>>>>>>> Benzema,@KaiBane,2025-05-05 00:05:23,1,0,https://youtube.com/watch?v=dxcFXoI6grM&lc=UgwEMPqfG64VF8gj7Eh4AaABAg
Ugxvdt8uN83fg5P65el4AaABAg,youtube,,why wasnt messi and neymar in the starting line upp😭,@cookingwithbilly-apa2,2025-04-30 11:59:20,0,4,https://youtube.com/watch?v=dxcFXoI6grM&lc=Ugxvdt8uN83fg5P65el4AaABAg
UgxbwR_x_dJ3IXqDVB54AaABAg,youtube,,Q clase pela para el Madrid,@BerniJR-s3u,2025-04-25 15:00:41,0,0,https://youtube.com/watch?v=dxcFXoI6grM&lc=UgxbwR_x_dJ3IXqDVB54AaABAg
UgwFy8iU-ZX71jiyu6B4AaABAg,youtube,,"F.C BARCELONA 
Más que un club 
❤️💙❤️💙❤️💙❤️",@nahummolina8507,2025-04-24 20:17:28,0,0,https://youtube.com/watch?v=dxcFXoI6grM&lc=UgwFy8iU-ZX71jiyu6B4AaABAg
Ugxfs_nbj_WmwmhLsWJ4AaABAg,youtube,,"In my opinion Jordi alba is underated 💎 
In stats he is better than marcelo...🐐",@M-ehsii......_,2025-04-24 18:20:17,0,0,https://youtube.com/watch?v=dxcFXoI6grM&lc=Ugxfs_nbj_WmwmhLsWJ4AaABAg
UgxwNdrNPVJX1BksRR14AaABAg,youtube,,luis suarez is very dangerius players,@andre_aj,2025-04-23 16:47:07,0,0,https://youtube.com/watch?v=dxcFXoI6grM&lc=UgxwNdrNPVJX1BksRR14AaABAg
UgzUshmPYp8_qNOPmMJ4AaABAg,youtube,,"Eramos felices y no lo sabiamos. Miras estos partidos y se sienten una eternidad, algunos jugadores ya retirados.",@abeld94,2025-04-21 20:12:47,2,0,https://youtube.com/watch?v=dxcFXoI6grM&lc=UgzUshmPYp8_qNOPmMJ4AaABAg
UgygRy18OVnIq_bm30t4AaABAg,youtube,,benzema missed suarez didnt,@NotMalix,2025-04-21 04:39:28,0,0,https://youtube.com/watch?v=dxcFXoI6grM&lc=UgygRy18OVnIq_bm30t4AaABAg
UgxShnGegJ-LoTpRXuN4AaABAg,youtube,,🖐️😂,@mariaterrazaz2570,2025-04-20 17:16:05,2,0,https://youtube.com/watch?v=dxcFXoI6grM&lc=UgxShnGegJ-LoTpRXuN4AaABAg
UgxlAkHWKxaSBOMUbWR4AaABAg,youtube,,"una leyenda del barça, no te vamos olvidar tan fácil",@funad_0,2025-04-19 19:28:24,1,0,https://youtube.com/watch?v=dxcFXoI6grM&lc=UgxlAkHWKxaSBOMUbWR4AaABAg
Ugz4zlCFF5Nu3vTcmF14AaABAg,youtube,,Justo en la nostalgia..,@samuelulloa7364,2025-04-19 05:36:30,1,0,https://youtube.com/watch?v=dxcFXoI6grM&lc=Ugz4zlCFF5Nu3vTcmF14AaABAg
